title,abstract,update_date,ai_generated
PAH emission and star formation in the host of the z~2.56 Cloverleaf QSO,"  We report the first detection of the 6.2micron and 7.7micron infrared `PAH'
emission features in the spectrum of a high redshift QSO, from the Spitzer-IRS
spectrum of the Cloverleaf lensed QSO (H1413+117, z~2.56). The ratio of PAH
features and rest frame far-infrared emission is the same as in lower
luminosity star forming ultraluminous infrared galaxies and in local PG QSOs,
supporting a predominantly starburst nature of the Cloverleaf's huge
far-infrared luminosity (5.4E12 Lsun, corrected for lensing). The Cloverleaf's
period of dominant QSO activity (Lbol ~ 7E13 Lsun) is coincident with an
intense (star formation rate ~1000 Msun/yr) and short (gas exhaustion time
~3E7yr) star forming event.
",2009-11-13,False
PAH emission and star formation in the host of the z~2.56 Cloverleaf QSO,"This research paper investigates the relationship between polycyclic aromatic hydrocarbon (PAH) emission and star formation in the host galaxy of the z~2.56 Cloverleaf quasar. Using high-resolution infrared spectroscopy data from the Spitzer Space Telescope, the study found a strong correlation between PAH emission and star formation rate. The results also suggest that the Cloverleaf quasars host galaxy is undergoing a phase of intense star formation, which is likely triggered by mergers or interactions with neighboring galaxies. These findings contribute to our understanding of the interplay between quasar activity and star formation in distant galaxies.",2009-11-13,True
Causal dissipative hydrodynamics for QGP fluid in 2+1 dimensions,"  In 2nd order causal dissipative theory, space-time evolution of QGP fluid is
studied in 2+1 dimensions. Relaxation equations for shear stress tensors are
solved simultaneously with the energy-momentum conservation equations.
Comparison of evolution of ideal and viscous QGP fluid, initialized under the
same conditions, e.g. same equilibration time, energy density and velocity
profile, indicate that in a viscous dynamics, energy density or temperature of
the fluid evolve slowly, than in an ideal fluid. Cooling gets slower as
viscosity increases. Transverse expansion also increases in a viscous dynamics.
For the first time we have also studied elliptic flow of 'quarks' in causal
viscous dynamics. It is shown that elliptic flow of quarks saturates due to
non-equilibrium correction to equilibrium distribution function, and can not be
mimicked by an ideal hydrodynamics.
",2007-08-01,False
Causal dissipative hydrodynamics for QGP fluid in 2+1 dimensions,"The paper proposes a new model of causal dissipative hydrodynamics for the quark-gluon plasma (QGP) fluid in 2+1 dimensions, which takes into account the effects of both thermal and quantum fluctuations. The model is based on a set of non-linear equations that describe the time evolution of the energy-momentum tensor and the dissipative currents in the fluid. The authors show that the model reproduces the known properties of the QGP fluid, such as the equation of state, the speed of sound and the shear viscosity. They also demonstrate that the model predicts a characteristic relaxation time for the dissipative currents, which is in agreement with the experimental data obtained from heavy-ion collisions. The authors conclude that the proposed model provides a new framework for understanding the dynamics of the QGP fluid and can be used to make predictions for future experimental studies.",2007-08-01,True
"Compounding Fields and Their Quantum Equations in the Trigintaduonion
  Space","  The 32-dimensional compounding fields and their quantum interplays in the
trigintaduonion space can be presented by analogy with octonion and sedenion
electromagnetic, gravitational, strong and weak interactions. In the
trigintaduonion fields which are associated with the electromagnetic,
gravitational, strong and weak interactions, the study deduces some conclusions
of field source particles (quarks and leptons) and intermediate particles which
are consistent with current some sorts of interaction theories. In the
trigintaduonion fields which are associated with the hyper-strong and
strong-weak fields, the paper draws some predicts and conclusions of the field
source particles (sub-quarks) and intermediate particles. The research results
show that there may exist some new particles in the nature.
",2011-11-09,False
"Compounding Fields and Their Quantum Equations in the Trigintaduonion
  Space","This research paper explores the use of compounding fields and their quantum equations in the trigintaduonion space as a basis. The trigintaduonion, a 32-dimensional extension of the quaternions, offers a unique framework for studying the interplay between fields and their quantum properties. Through mathematical analysis and numerical simulations, the paper investigates the behavior of compounding fields in the trigintaduonion space and their corresponding quantum equations. The results suggest that this approach can provide a powerful tool for understanding the dynamics of complex systems and may have applications in fields such as quantum computing and particle physics. Overall, this research sheds light on the potential of the trigintaduonion space as a new frontier in the study of quantum phenomena.",2011-11-09,True
"Topological defects, geometric phases, and the angular momentum of light","  Recent reports on the intriguing features of vector vortex bearing beams are
analyzed using geometric phases in optics. It is argued that the spin
redirection phase induced circular birefringence is the origin of topological
phase singularities arising in the inhomogeneous polarization patterns. A
unified picture of recent results is presented based on this proposition.
Angular momentum shift within the light beam (OAM) has exact equivalence with
the angular momentum holonomy associated with the geometric phase consistent
with our conjecture.
",2009-05-15,False
"Topological defects, geometric phases, and the angular momentum of light","This research paper explores the interplay between topological defects, geometric phases, and the angular momentum of light. Topological defects, such as singularities and vortices, can affect the geometric phase of light and alter its angular momentum. By analyzing the behavior of light in the presence of topological defects, this paper aims to provide a deeper understanding of the fundamental principles governing the interaction between light and matter. The results of this research could have important implications for the development of new technologies, including optical communication and quantum computing.",2009-05-15,True
The Blue Straggler Population of the Globular Cluster M5,"  By combining high-resolution HST and wide-field ground based observations, in
ultraviolet and optical bands, we study the Blue Stragglers Star (BSS)
population of the galactic globular cluster M5 (NGC 5904) from its very central
regions up to its periphery. The BSS distribution is highly peaked in the
cluster center, decreases at intermediate radii and rises again outward. Such a
bimodal distribution is similar to those previously observed in other globular
clusters (M3, 47Tucanae, NGC6752). As for these clusters, dynamical simulations
suggest that, while the majority of BSS in M5 could be originated by stellar
collisions, a significant fraction (20-40%) of BSS generated by mass transfer
processes in primordial binaries is required to reproduce the observed radial
distribution. A candidate BSS has been detected beyond the cluster tidal
radius. If confirmed, this could represent an interesting case of an
""evaporating"" BSS.
",2009-06-23,False
The Blue Straggler Population of the Globular Cluster M5,"This research paper investigates the blue straggler population of the globular cluster M5. The primary objective of the study is to understand the formation and evolution of blue stragglers, which are stars that appear to be younger and more massive than the other stars in the cluster. The researchers used data from the Hubble Space Telescope and ground-based observations to identify blue stragglers in M5 and study their properties. The study found that the blue straggler population of M5 is much larger than previously thought, and that these stars have a wide range of masses and ages. The researchers also found evidence of mass transfer between binary stars as a possible mechanism for the formation of blue stragglers. Overall, the study provides important insights into the formation and evolution of stars in globular clusters and helps to improve our understanding of the complex processes that shape the universe.",2009-06-23,True
Entanglement entropy of two-dimensional Anti-de Sitter black holes,"  Using the AdS/CFT correspondence we derive a formula for the entanglement
entropy of the anti-de Sitter black hole in two spacetime dimensions. The
leading term in the large black hole mass expansion of our formula reproduces
exactly the Bekenstein-Hawking entropy S_{BH}, whereas the subleading term
behaves as ln S_{BH}. This subleading term has the universal form typical for
the entanglement entropy of physical systems described by effective conformal
fields theories (e.g. one-dimensional statistical models at the critical
point). The well-known form of the entanglement entropy for a two-dimensional
conformal field theory is obtained as analytic continuation of our result and
is related with the entanglement entropy of a black hole with negative mass.
",2008-11-26,False
Entanglement entropy of two-dimensional Anti-de Sitter black holes,"This research paper explores the concept of entanglement entropy in two-dimensional Anti-de Sitter (AdS) black holes. Entanglement entropy is a measure of the entanglement between two subsystems of a quantum system, which has been shown to have important implications for quantum information theory and the study of black holes. The paper specifically focuses on the entanglement entropy of two-dimensional AdS black holes, which have been the subject of much recent research. The authors use a combination of analytical and numerical techniques to investigate the behavior of entanglement entropy in these black holes as a function of various parameters, such as the size of the black hole and the strength of the gravitational potential. The results of the study provide important insights into the nature of entanglement entropy in AdS black holes and contribute to a deeper understanding of the fundamental properties of these fascinating objects.",2008-11-26,True
A POVM view of the ensemble approach to polarization optics,"  Statistical ensemble formalism of Kim, Mandel and Wolf (J. Opt. Soc. Am. A 4,
433 (1987)) offers a realistic model for characterizing the effect of
stochastic non-image forming optical media on the state of polarization of
transmittedlight. With suitable choice of the Jones ensemble, various Mueller
transformations - some of which have been unknown so far - are deduced. It is
observed that the ensemble approach is formally identical to the positive
operator valued measures (POVM) on the quantum density matrix. This
observation, in combination with the recent suggestion by Ahnert and Payne
(Phys. Rev. A 71, 012330, (2005)) - in the context of generalized quantum
measurement on single photon polarization states - that linear optics elements
can be employed in setting up all possible POVMs, enables us to propose a way
of realizing different types of Mueller devices.
",2007-06-26,False
A POVM view of the ensemble approach to polarization optics,"This research paper presents a new approach to understanding polarization optics, using the mathematical framework of Positive Operator-Valued Measures (POVMs). The ensemble approach to polarization optics is explored, and a POVM-based model is developed to describe the behavior of polarized light passing through optical systems. The paper shows that the POVM approach offers a powerful and flexible way to analyze and design polarization optics, and can lead to new insights into the nature of polarization phenomena. The main result of the paper is the development of a POVM-based formalism for polarization optics, which is shown to be mathematically rigorous and physically meaningful. The conclusion is that the POVM approach represents a valuable new tool for researchers in the field of polarization optics, with potential applications in areas such as optical communication, imaging, and sensing.",2007-06-26,True
Construction of initial data for 3+1 numerical relativity,"  This lecture is devoted to the problem of computing initial data for the
Cauchy problem of 3+1 general relativity. The main task is to solve the
constraint equations. The conformal technique, introduced by Lichnerowicz and
enhanced by York, is presented. Two standard methods, the conformal
transverse-traceless one and the conformal thin sandwich, are discussed and
illustrated by some simple examples. Finally a short review regarding initial
data for binary systems (black holes and neutron stars) is given.
",2008-11-26,False
Construction of initial data for 3+1 numerical relativity,"This research paper focuses on the construction of initial data for 3+1 numerical relativity. The main points covered include a review of the 3+1 formalism, a discussion on the different types of initial data, and a detailed explanation of the conformal transverse-traceless decomposition method. The paper also includes noteworthy findings, such as the importance of choosing suitable gauge conditions and the potential use of conformal techniques in constructing initial data for binary black hole simulations. The conclusion emphasizes the significance of accurate initial data in numerical relativity simulations and the potential impact on gravitational wave observations.",2008-11-26,True
"Reciprocal Symmetry and Classical Discrete Oscillator Incorporating
  Half-Integral Energy Levels","  Classical oscillator differential equation is replaced by the corresponding
(finite time) difference equation. The equation is, then, symmetrized so that
it remains invariant under the change d going to -d, where d is the smallest
span of time. This symmetric equation has solutions, which come in reciprocally
related pairs. One member of a pair agrees with the classical solution and the
other is an oscillating solution and does not converge to a limit as d goes to
0. This solution contributes to oscillator energy a term which is a multiple of
half-integers.
",2007-05-23,False
"Reciprocal Symmetry and Classical Discrete Oscillator Incorporating
  Half-Integral Energy Levels","This research paper explores the concept of reciprocal symmetry in classical discrete oscillators incorporating half-integral energy levels. The primary focus is on the mathematical analysis of the relationship between reciprocal symmetry and energy levels in these systems. The study finds that the presence of half-integral energy levels leads to the breakdown of reciprocal symmetry, which has important implications for the behavior of these oscillators. The research provides insights into the fundamental principles underlying the behavior of classical discrete oscillators and highlights the importance of considering energy levels in understanding their dynamics.",2007-05-23,True
"A computer program for fast non-LTE analysis of interstellar line
  spectra","  The large quantity and high quality of modern radio and infrared line
observations require efficient modeling techniques to infer physical and
chemical parameters such as temperature, density, and molecular abundances. We
present a computer program to calculate the intensities of atomic and molecular
lines produced in a uniform medium, based on statistical equilibrium
calculations involving collisional and radiative processes and including
radiation from background sources. Optical depth effects are treated with an
escape probability method. The program is available on the World Wide Web at
http://www.sron.rug.nl/~vdtak/radex/index.shtml . The program makes use of
molecular data files maintained in the Leiden Atomic and Molecular Database
(LAMDA), which will continue to be improved and expanded. The performance of
the program is compared with more approximate and with more sophisticated
methods. An Appendix provides diagnostic plots to estimate physical parameters
from line intensity ratios of commonly observed molecules. This program should
form an important tool in analyzing observations from current and future radio
and infrared telescopes.
",2015-05-13,False
"A computer program for fast non-LTE analysis of interstellar line
  spectra","This research paper presents a new computer program designed for efficient non-LTE analysis of interstellar line spectra. The program is capable of handling large datasets and complex physical conditions, making it a valuable tool for studying interstellar medium. The study also highlights the importance of non-LTE analysis in accurately determining the physical properties and chemical composition of interstellar gas. The findings suggest that the program can significantly improve the accuracy and speed of analyzing interstellar line spectra, enabling more detailed and comprehensive studies of interstellar gas.",2015-05-13,True
"Alternative Approaches to the Equilibrium Properties of Hard-Sphere
  Liquids","  An overview of some analytical approaches to the computation of the
structural and thermodynamic properties of single component and multicomponent
hard-sphere fluids is provided. For the structural properties, they yield a
thermodynamically consistent formulation, thus improving and extending the
known analytical results of the Percus-Yevick theory. Approximate expressions
for the contact values of the radial distribution functions and the
corresponding analytical equations of state are also discussed. Extensions of
this methodology to related systems, such as sticky hard spheres and
square-well fluids, as well as its use in connection with the perturbation
theory of fluids are briefly addressed.
",2008-07-18,False
"Alternative Approaches to the Equilibrium Properties of Hard-Sphere
  Liquids","This research paper explores alternative approaches to understanding the equilibrium properties of hard-sphere liquids. The main objective is to investigate the accuracy and efficiency of different methods for calculating the thermodynamic properties of these liquids, including the radial distribution function, pressure, and compressibility. Using computer simulations and analytical techniques, we compare the results obtained from Monte Carlo simulations, molecular dynamics simulations, and integral equation theories. Our findings reveal that while each method has its advantages and limitations, integral equation theories provide the most accurate and efficient approach for calculating the thermodynamic properties of hard-sphere liquids over a wide range of densities and temperatures. These results have significant implications for the design and optimization of processes involving hard-sphere liquids, such as colloidal suspensions and nanoparticle dispersions.",2008-07-18,True
Oxygen-rich droplets and the enrichment of the ISM,"  We argue that the discrepancies observed in HII regions between abundances
derived from optical recombination lines (ORLs) and collisionally excited lines
(CELs) might well be the signature of a scenario of the enrichment of the
interstellar medium (ISM) proposed by Tenorio-Tagle (1996). In this scenario,
the fresh oxygen released during massive supernova explosions is confined
within the hot superbubbles as long as supernovae continue to explode. Only
after the last massive supernova explosion, the metal-rich gas starts cooling
down and falls on the galaxy within metal-rich droplets. Full mixing of these
metal-rich droplets and the ISM occurs during photoionization by the next
generations of massive stars. During this process, the metal-rich droplets give
rise to strong recombination lines of the metals, leading to the observed
ORL-CEL discrepancy. (The full version of this work is submitted to Astronomy
and Astrophysics.)
",2007-05-23,False
Oxygen-rich droplets and the enrichment of the ISM,"This research paper explores the role of oxygen-rich droplets in enriching the interstellar medium (ISM). The main objective is to investigate the formation, dynamics, and chemical processes of these droplets and their potential contribution to the abundance of oxygen in the ISM. Using numerical simulations and observational data, the authors demonstrate that oxygen-rich droplets can form in the outflows of oxygen-rich stars, and that they can survive in the ISM for millions of years. These droplets can also trigger the formation of new stars and planets, and may have played a key role in the evolution of the early universe. The study concludes that oxygen-rich droplets are an important source of oxygen enrichment in the ISM, and that further research is needed to fully understand their impact on the chemical evolution of galaxies.",2007-05-23,True
"Soft modes and NTE in Zn(CN)2 from Raman spectroscopy and first
  principles calculations","  We have studied Zn(CN)2 at high pressure using Raman spectroscopy, and report
Gruneisen parameters of the soft phonons. The phonon frequencies and eigen
vectors obtained from ab-initio calculations are used for the assignment of the
observed phonon spectra. Out of the eleven zone-centre optical modes, six modes
exhibit negative Gruneisen parameter. The calculations suggest that the soft
phonons correspond to the librational and translational modes of CN rigid unit,
with librational modes contributing more to thermal expansion. A rapid
disordering of the lattice is found above 1.6 GPa from X-ray diffraction.
",2009-11-13,False
"Soft modes and NTE in Zn(CN)2 from Raman spectroscopy and first
  principles calculations","Soft modes and negative thermal expansion (NTE) in Zn(CN)2 have been investigated using Raman spectroscopy and first principles calculations. The results show that Zn(CN)2 exhibits anisotropic NTE, which is attributed to the softening of specific phonon modes. Theoretical calculations and Raman spectroscopy provide complementary evidence for the existence of these soft modes. The study also highlights the importance of considering crystal anisotropy in understanding NTE in Zn(CN)2. These findings provide insights into the fundamental mechanisms of NTE in molecular materials and offer potential applications in thermal management.",2009-11-13,True
Estimation of experimental data redundancy and related statistics,"  Redundancy of experimental data is the basic statistic from which the
complexity of a natural phenomenon and the proper number of experiments needed
for its exploration can be estimated. The redundancy is expressed by the
entropy of information pertaining to the probability density function of
experimental variables. Since the calculation of entropy is inconvenient due to
integration over a range of variables, an approximate expression for redundancy
is derived that includes only a sum over the set of experimental data about
these variables. The approximation makes feasible an efficient estimation of
the redundancy of data along with the related experimental information and
information cost function. From the experimental information the complexity of
the phenomenon can be simply estimated, while the proper number of experiments
needed for its exploration can be determined from the minimum of the cost
function. The performance of the approximate estimation of these statistics is
demonstrated on two-dimensional normally distributed random data.
",2007-10-10,False
Estimation of experimental data redundancy and related statistics,"This research paper aims to propose a method for estimating the redundancy of experimental data and related statistics. The proposed approach involves the use of statistical techniques to analyze the data and determine the level of redundancy. The research explores various factors that contribute to the redundancy of data, including measurement error, experimental design, and sample size. Additionally, the study examines the impact of redundancy on the accuracy and precision of statistical estimates. The research findings provide valuable insights into the importance of data redundancy in experimental design and statistical analysis. The proposed method can be used to optimize experimental design and improve the accuracy of statistical estimates, thereby enhancing the quality of scientific research.",2007-10-10,True
Effective potentials for quasicrystals from ab-initio data,"  Classical effective potentials are indispensable for any large-scale
atomistic simulations, and the relevance of simulation results crucially
depends on the quality of the potentials used. For complex alloys like
quasicrystals, however, realistic effective potentials are practically
inexistent. We report here on our efforts to develop effective potentials
especially for quasicrystalline alloy systems. We use the so-called force
matching method, in which the potential parameters are adapted so as to
optimally reproduce the forces and energies in a set of suitably chosen
reference configurations. These reference data are calculated with ab-initio
methods. As a first application, EAM potentials for decagonal Al-Ni-Co,
icosahedral Ca-Cd, and both icosahedral and decagonal Mg-Zn quasicrystals have
been constructed. The influence of the potential range and degree of
specialisation on the accuracy and other properties is discussed and compared.
",2009-07-07,False
