title,abstract,update_date,ai_generated
"Calculation of prompt diphoton production cross sections at Tevatron and
  LHC energies","  A fully differential calculation in perturbative quantum chromodynamics is
presented for the production of massive photon pairs at hadron colliders. All
next-to-leading order perturbative contributions from quark-antiquark,
gluon-(anti)quark, and gluon-gluon subprocesses are included, as well as
all-orders resummation of initial-state gluon radiation valid at
next-to-next-to-leading logarithmic accuracy. The region of phase space is
specified in which the calculation is most reliable. Good agreement is
demonstrated with data from the Fermilab Tevatron, and predictions are made for
more detailed tests with CDF and DO data. Predictions are shown for
distributions of diphoton pairs produced at the energy of the Large Hadron
Collider (LHC). Distributions of the diphoton pairs from the decay of a Higgs
boson are contrasted with those produced from QCD processes at the LHC, showing
that enhanced sensitivity to the signal can be obtained with judicious
selection of events.
",2008-11-26,False
"Calculation of prompt diphoton production cross sections at Tevatron and
  LHC energies","The research paper titled ""Calculation of prompt diphoton production cross sections at Tevatron and LHC energies"" aimed to calculate the production cross sections of prompt diphoton events at both Tevatron and LHC energies. The primary objective was to provide theoretical predictions for these cross sections, which could be compared with experimental data to test the validity of the Standard Model of particle physics. 

The researchers used the Next-to-Leading-Order (NLO) QCD calculations to predict the cross sections for diphoton production. They also compared their results with previous calculations and experimental data. 

The study concluded that the NLO QCD calculations provide reasonable predictions for the prompt diphoton production cross sections at both Tevatron and LHC energies. The results were consistent with previous calculations and experimental data, which provides further evidence for the validity of the Standard Model. 

Overall, this research provides valuable insights into the production of prompt diphoton events and further supports the Standard Model of particle physics.",2008-11-26,True
Polymer Quantum Mechanics and its Continuum Limit,"  A rather non-standard quantum representation of the canonical commutation
relations of quantum mechanics systems, known as the polymer representation has
gained some attention in recent years, due to its possible relation with Planck
scale physics. In particular, this approach has been followed in a symmetric
sector of loop quantum gravity known as loop quantum cosmology. Here we explore
different aspects of the relation between the ordinary Schroedinger theory and
the polymer description. The paper has two parts. In the first one, we derive
the polymer quantum mechanics starting from the ordinary Schroedinger theory
and show that the polymer description arises as an appropriate limit. In the
second part we consider the continuum limit of this theory, namely, the reverse
process in which one starts from the discrete theory and tries to recover back
the ordinary Schroedinger quantum mechanics. We consider several examples of
interest, including the harmonic oscillator, the free particle and a simple
cosmological model.
",2008-11-26,False
Polymer Quantum Mechanics and its Continuum Limit,"This research paper investigates the application of quantum mechanics to polymer systems and its continuum limit. The study demonstrates the potential of quantum mechanics in predicting the properties and behavior of polymer materials at the molecular level. The research also explores the continuum limit of polymer systems, which is an essential concept in modeling polymers at a larger scale. The results suggest that the continuum limit can provide useful insights into the behavior of polymer materials and help in developing new materials with desired properties. Overall, this study highlights the significance of the intersection of quantum mechanics and polymer science and its potential impact on materials research and development.",2008-11-26,True
"Numerical solution of shock and ramp compression for general material
  properties","  A general formulation was developed to represent material models for
applications in dynamic loading. Numerical methods were devised to calculate
response to shock and ramp compression, and ramp decompression, generalizing
previous solutions for scalar equations of state. The numerical methods were
found to be flexible and robust, and matched analytic results to a high
accuracy. The basic ramp and shock solution methods were coupled to solve for
composite deformation paths, such as shock-induced impacts, and shock
interactions with a planar interface between different materials. These
calculations capture much of the physics of typical material dynamics
experiments, without requiring spatially-resolving simulations. Example
calculations were made of loading histories in metals, illustrating the effects
of plastic work on the temperatures induced in quasi-isentropic and
shock-release experiments, and the effect of a phase transition.
",2009-02-05,False
"Numerical solution of shock and ramp compression for general material
  properties","This research paper proposes a numerical approach for solving shock and ramp compression problems for materials with general properties. The study focuses on developing a computational algorithm that can predict the behavior of materials under extreme conditions, such as shock and ramp compression. The proposed method employs a finite element approach to solve the governing equations of motion for the material. The study also considers the effect of various material properties, including elasticity, plasticity, and viscosity, on the response of the material to compression. The results of the numerical simulations are compared with experimental data to validate the accuracy of the proposed method. The study finds that the developed algorithm provides an efficient and accurate tool for predicting the response of materials under extreme conditions, which can be useful in designing and optimizing materials for various applications.",2009-02-05,True
"Partial cubes: structures, characterizations, and constructions","  Partial cubes are isometric subgraphs of hypercubes. Structures on a graph
defined by means of semicubes, and Djokovi\'{c}'s and Winkler's relations play
an important role in the theory of partial cubes. These structures are employed
in the paper to characterize bipartite graphs and partial cubes of arbitrary
dimension. New characterizations are established and new proofs of some known
results are given.
  The operations of Cartesian product and pasting, and expansion and
contraction processes are utilized in the paper to construct new partial cubes
from old ones. In particular, the isometric and lattice dimensions of finite
partial cubes obtained by means of these operations are calculated.
",2007-05-23,False
"Partial cubes: structures, characterizations, and constructions","Partial cubes are a class of graphs that have been studied extensively due to their applications in fields such as computer science and chemistry. In this paper, we explore the structure and characterization of partial cubes, as well as their constructions. We prove several important theorems, including a characterization of partial cubes based on their cut vertices, and a construction method for partial cubes based on their spanning trees. Additionally, we investigate the properties and applications of partial cubes in various contexts, such as graph coloring and graph isomorphism. Our results provide a deeper understanding of partial cubes and their significance in both theoretical and practical domains.",2007-05-23,True
Stochastic Lie group integrators,"  We present Lie group integrators for nonlinear stochastic differential
equations with non-commutative vector fields whose solution evolves on a smooth
finite dimensional manifold. Given a Lie group action that generates transport
along the manifold, we pull back the stochastic flow on the manifold to the Lie
group via the action, and subsequently pull back the flow to the corresponding
Lie algebra via the exponential map. We construct an approximation to the
stochastic flow in the Lie algebra via closed operations and then push back to
the Lie group and then to the manifold, thus ensuring our approximation lies in
the manifold. We call such schemes stochastic Munthe-Kaas methods after their
deterministic counterparts. We also present stochastic Lie group integration
schemes based on Castell--Gaines methods. These involve using an underlying
ordinary differential integrator to approximate the flow generated by a
truncated stochastic exponential Lie series. They become stochastic Lie group
integrator schemes if we use Munthe-Kaas methods as the underlying ordinary
differential integrator. Further, we show that some Castell--Gaines methods are
uniformly more accurate than the corresponding stochastic Taylor schemes.
Lastly we demonstrate our methods by simulating the dynamics of a free rigid
body such as a satellite and an autonomous underwater vehicle both perturbed by
two independent multiplicative stochastic noise processes.
",2007-10-16,False
Stochastic Lie group integrators,"This research paper aims to introduce and analyze the concept of stochastic Lie group integrators, which are numerical methods used to solve stochastic differential equations on Lie groups. The paper will first provide a brief overview of Lie groups and their relevance in physics and mathematics, followed by a discussion of stochastic differential equations and their applications. The main focus of the paper will be on the development and analysis of various stochastic Lie group integrators, including their convergence properties and computational efficiency. The paper will also include numerical simulations and comparisons of different stochastic Lie group integrators to demonstrate their effectiveness in solving stochastic differential equations on Lie groups. The results of this study have implications for a wide range of fields, including physics, engineering, and finance.",2007-10-16,True
ALMA as the ideal probe of the solar chromosphere,"  The very nature of the solar chromosphere, its structuring and dynamics,
remains far from being properly understood, in spite of intensive research.
Here we point out the potential of chromospheric observations at millimeter
wavelengths to resolve this long-standing problem. Computations carried out
with a sophisticated dynamic model of the solar chromosphere due to Carlsson
and Stein demonstrate that millimeter emission is extremely sensitive to
dynamic processes in the chromosphere and the appropriate wavelengths to look
for dynamic signatures are in the range 0.8-5.0 mm. The model also suggests
that high resolution observations at mm wavelengths, as will be provided by
ALMA, will have the unique property of reacting to both the hot and the cool
gas, and thus will have the potential of distinguishing between rival models of
the solar atmosphere. Thus, initial results obtained from the observations of
the quiet Sun at 3.5 mm with the BIMA array (resolution of 12 arcsec) reveal
significant oscillations with amplitudes of 50-150 K and frequencies of 1.5-8
mHz with a tendency toward short-period oscillations in internetwork and longer
periods in network regions. However higher spatial resolution, such as that
provided by ALMA, is required for a clean separation between the features
within the solar atmosphere and for an adequate comparison with the output of
the comprehensive dynamic simulations.
",2009-06-23,False
ALMA as the ideal probe of the solar chromosphere,"The Atacama Large Millimeter/submillimeter Array (ALMA) is a powerful telescope capable of observing the solar chromosphere in unprecedented detail. In this research paper, we argue that ALMA is the ideal probe of the solar chromosphere due to its high spatial and temporal resolution, sensitivity, and ability to observe at multiple wavelengths. We review recent observations of the chromosphere using ALMA and discuss how these observations have improved our understanding of the dynamics and structure of this region of the solar atmosphere. We also discuss future directions for ALMA observations of the chromosphere and their potential impact on our understanding of solar physics. Overall, we conclude that ALMA is an essential tool for studying the chromosphere and will continue to provide valuable insights into this important region of the Sun.",2009-06-23,True
"Formation of quasi-solitons in transverse confined ferromagnetic film
  media","  The formation of quasi-2D spin-wave waveforms in longitudinally magnetized
stripes of ferrimagnetic film was observed by using time- and space-resolved
Brillouin light scattering technique. In the linear regime it was found that
the confinement decreases the amplitude of dynamic magnetization near the
lateral stripe edges. Thus, the so-called effective dipolar pinning of dynamic
magnetization takes place at the edges.
  In the nonlinear regime a new stable spin wave packet propagating along a
waveguide structure, for which both transversal instability and interaction
with the side walls of the waveguide are important was observed. The
experiments and a numerical simulation of the pulse evolution show that the
shape of the formed waveforms and their behavior are strongly influenced by the
confinement.
",2007-05-30,False
"Formation of quasi-solitons in transverse confined ferromagnetic film
  media",This research paper investigates the formation of quasi-solitons in transversely confined ferromagnetic film media. The authors conducted numerical simulations using the Landau-Lifshitz-Gilbert equation to show that the quasi-solitons are formed due to the interaction between the magnetization and the confinement potential. The study found that the size and shape of the confinement potential play an important role in the formation and dynamics of the quasi-solitons. The results of this study provide insights into the behavior of confined ferromagnetic films and may have potential applications in magnetic data storage and spintronics.,2007-05-30,True
"Spectroscopic Properties of Polarons in Strongly Correlated Systems by
  Exact Diagrammatic Monte Carlo Method","  We present recent advances in understanding of the ground and excited states
of the electron-phonon coupled systems obtained by novel methods of
Diagrammatic Monte Carlo and Stochastic Optimization, which enable the
approximation-free calculation of Matsubara Green function in imaginary times
and perform unbiased analytic continuation to real frequencies. We present
exact numeric results on the ground state properties, Lehmann spectral function
and optical conductivity of different strongly correlated systems: Frohlich
polaron, Rashba-Pekar exciton-polaron, pseudo Jahn-Teller polaron, exciton, and
interacting with phonons hole in the t-J model.
",2015-05-13,False
"Spectroscopic Properties of Polarons in Strongly Correlated Systems by
  Exact Diagrammatic Monte Carlo Method","This research paper focuses on the study of the spectroscopic properties of polarons in strongly correlated systems using the Exact Diagrammatic Monte Carlo method. The primary theme of the research is to understand the electronic structure and dynamics of polarons in materials with strong electron-electron interactions. The study finds that the polaronic effects are enhanced in strongly correlated systems, leading to a significant change in the spectral properties of the material. The Exact Diagrammatic Monte Carlo method is shown to be a powerful tool for investigating the polaronic effects in strongly correlated systems. The research provides important insights into the behavior of polarons in materials with strong electron-electron interactions, which can be useful for designing new materials with desired electronic properties.",2015-05-13,True
"Placeholder Substructures II: Meta-Fractals, Made of Box-Kites, Fill
  Infinite-Dimensional Skies","  Zero-divisors (ZDs) derived by Cayley-Dickson Process (CDP) from
N-dimensional hypercomplex numbers (N a power of 2, at least 4) can represent
singularities and, as N approaches infinite, fractals -- and thereby,scale-free
networks. Any integer greater than 8 and not a power of 2 generates a
meta-fractal or ""Sky"" when it is interpreted as the ""strut constant"" (S) of an
ensemble of octahedral vertex figures called ""Box-Kites"" (the fundamental
building blocks of ZDs). Remarkably simple bit-manipulation rules or ""recipes""
provide tools for transforming one fractal genus into others within the context
of Wolfram's Class 4 complexity.
",2007-11-22,False
"Placeholder Substructures II: Meta-Fractals, Made of Box-Kites, Fill
  Infinite-Dimensional Skies","Unfortunately, I am unable to provide a concise abstract for a research paper with the given title as it appears to be non-existent or not publicly available. Can you please provide me with more information or clarify if this is a hypothetical research paper title",2007-11-22,True
Tuning correlation effects with electron-phonon interactions,"  We investigate the effect of tuning the phonon energy on the correlation
effects in models of electron-phonon interactions using DMFT. In the regime
where itinerant electrons, instantaneous electron-phonon driven correlations
and static distortions compete on similar energy scales, we find several
interesting results including (1) A crossover from band to Mott behavior in the
spectral function, leading to hybrid band/Mott features in the spectral
function for phonon frequencies slightly larger than the band width. (2) Since
the optical conductivity depends sensitively on the form of the spectral
function, we show that such a regime should be observable through the low
frequency form of the optical conductivity. (3) The resistivity has a double
kondo peak arrangement
",2015-05-13,False
Tuning correlation effects with electron-phonon interactions,"The paper investigates the interplay between electron-electron and electron-phonon interactions in a correlated electron system. The main objective is to understand the effect of electron-phonon interactions on the electronic correlation strength and to explore the possibility of tuning the correlation effects with phonon degrees of freedom. The study employs a combination of dynamical mean field theory and density functional theory calculations to investigate the electronic structure and correlation effects in a model system. The results show that the electron-phonon coupling can significantly modify the correlation strength in the system, leading to a crossover from a correlated metallic to a weakly correlated insulating state. The study also reveals that the correlation effects can be tuned by varying the phonon frequencies, providing a promising avenue for controlling the electronic properties of correlated materials. These findings have important implications for the design and development of novel electronic materials with tailored correlation properties.",2015-05-13,True
"Crystal channeling of LHC forward protons with preserved distribution in
  phase space","  We show that crystal can trap a broad (x, x', y, y', E) distribution of
particles and channel it preserved with a high precision. This sampled-and-hold
distribution can be steered by a bent crystal for analysis downstream. In
simulations for the 7 TeV Large Hadron Collider, a crystal adapted to the
accelerator lattice traps 90% of diffractively scattered protons emerging from
the interaction point with a divergence 100 times the critical angle. We set
the criterion for crystal adaptation improving efficiency ~100-fold. Proton
angles are preserved in crystal transmission with accuracy down to 0.1
microrad. This makes feasible a crystal application for measuring very forward
protons at the LHC.
",2008-11-26,False
"Crystal channeling of LHC forward protons with preserved distribution in
  phase space","This research paper discusses the crystal channeling of forward protons in the Large Hadron Collider (LHC) with preserved distribution in phase space. The study focuses on the use of bent crystals to deflect proton beams, while preserving their momentum and transverse distribution. The results show that crystal channeling can be used to manipulate the trajectory of protons without significantly affecting their phase space distribution. This technique has potential applications in high-energy physics experiments, as well as in medical and industrial applications. The study concludes that crystal channeling is a promising tool for manipulating charged particle beams and that further research is needed to optimize the process for practical applications.",2008-11-26,True
"Convergence of the discrete dipole approximation. II. An extrapolation
  technique to increase the accuracy","  We propose an extrapolation technique that allows accuracy improvement of the
discrete dipole approximation computations. The performance of this technique
was studied empirically based on extensive simulations for 5 test cases using
many different discretizations. The quality of the extrapolation improves with
refining discretization reaching extraordinary performance especially for
cubically shaped particles. A two order of magnitude decrease of error was
demonstrated. We also propose estimates of the extrapolation error, which were
proven to be reliable. Finally we propose a simple method to directly separate
shape and discretization errors and illustrated this for one test case.
",2008-07-29,False
"Convergence of the discrete dipole approximation. II. An extrapolation
  technique to increase the accuracy","This research paper focuses on the convergence of the discrete dipole approximation (DDA) and presents an extrapolation technique to improve its accuracy. The DDA is widely used to model electromagnetic scattering from particles, but it suffers from slow convergence, particularly for large and highly absorbing particles. In this paper, we propose an extrapolation technique that combines results from DDA simulations with different grid sizes, enabling us to achieve higher accuracy with a lower computational cost. We demonstrate the effectiveness of this technique by comparing the results with reference solutions for several test cases. Our results show that the extrapolation technique significantly improves the convergence rate of the DDA, leading to more accurate and efficient simulations. This technique has potential applications in various fields, including atmospheric and environmental sciences, material science, and biomedical engineering.",2008-07-29,True
Quantum Group of Isometries in Classical and Noncommutative Geometry,"  We formulate a quantum generalization of the notion of the group of
Riemannian isometries for a compact Riemannian manifold, by introducing a
natural notion of smooth and isometric action by a compact quantum group on a
classical or noncommutative manifold described by spectral triples, and then
proving the existence of a universal object (called the quantum isometry group)
in the category of compact quantum groups acting smoothly and isometrically on
a given (possibly noncommutative) manifold satisfying certain regularity
assumptions. In fact, we identify the quantum isometry group with the universal
object in a bigger category, namely the category of `quantum families of smooth
isometries', defined along the line of Woronowicz and Soltan. We also construct
a spectral triple on the Hilbert space of forms on a noncommutative manifold
which is equivariant with respect to a natural unitary representation of the
quantum isometry group. We give explicit description of quantum isometry groups
of commutative and noncommutative tori, and in this context, obtain the quantum
double torus defined in \cite{hajac} as the universal quantum group of
holomorphic isometries of the noncommutative torus.
",2009-11-13,False
Quantum Group of Isometries in Classical and Noncommutative Geometry,"The research paper discusses the concept of quantum group of isometries in both classical and noncommutative geometry. The authors explore the relationship between these two fields and present a new approach to studying quantum groups of isometries using noncommutative geometry. The paper highlights the importance of understanding the structure of quantum groups in various geometries and provides key results that enable further exploration of this concept. The authors conclude that a deeper understanding of the quantum group of isometries can lead to new insights in areas such as mathematical physics, differential geometry, and topology.",2009-11-13,True
"General System theory, Like-Quantum Semantics and Fuzzy Sets","  It is outlined the possibility to extend the quantum formalism in relation to
the requirements of the general systems theory. It can be done by using a
quantum semantics arising from the deep logical structure of quantum theory. It
is so possible taking into account the logical openness relationship between
observer and system. We are going to show how considering the truth-values of
quantum propositions within the context of the fuzzy sets is here more useful
for systemics . In conclusion we propose an example of formal quantum
coherence.
",2010-04-26,False
